    10.30.1.65.44204 > 10.30.5.234.22: Flags [S], cksum 0x64f3 (correct), seq 1869515002, win 29200, options [mss 1460,sackOK,TS val 13868828 ecr 0,nop,wscale 7], length 0
    10.30.1.65.59380 > 10.30.5.234.199: Flags [S], cksum 0xae92 (correct), seq 2488524287, win 29200, options [mss 1460,sackOK,TS val 13868953 ecr 0,nop,wscale 7], length 0
    10.30.1.65.42917 > 10.30.5.234.143: Flags [S], cksum 0xc276 (correct), seq 3164266973, win 29200, options [mss 1460,sackOK,TS val 13869079 ecr 0,nop,wscale 7], length 0
    10.30.1.65.40446 > 10.30.5.234.995: Flags [S], cksum 0x0e3e (correct), seq 2890181699, win 29200, options [mss 1460,sackOK,TS val 13869203 ecr 0,nop,wscale 7], length 0
    10.30.1.65.44540 > 10.30.5.234.256: Flags [S], cksum 0xfdeb (correct), seq 3828381457, win 29200, options [mss 1460,sackOK,TS val 13869328 ecr 0,nop,wscale 7], length 0
    10.30.1.65.55476 > 10.30.5.234.21: Flags [S], cksum 0x6ea7 (correct), seq 1203206277, win 29200, options [mss 1460,sackOK,TS val 13869453 ecr 0,nop,wscale 7], length 0
    10.30.1.65.41728 > 10.30.5.234.3306: Flags [S], cksum 0xc159 (correct), seq 554398945, win 29200, options [mss 1460,sackOK,TS val 13869578 ecr 0,nop,wscale 7], length 0
    10.30.1.65.47211 > 10.30.5.234.8080: Flags [S], cksum 0x89e1 (correct), seq 498304803, win 29200, options [mss 1460,sackOK,TS val 13869703 ecr 0,nop,wscale 7], length 0
    10.30.1.65.53112 > 10.30.5.234.8888: Flags [S], cksum 0x4fa9 (correct), seq 584294793, win 29200, options [mss 1460,sackOK,TS val 13869828 ecr 0,nop,wscale 7], length 0
    10.30.1.65.50171 > 10.30.5.234.554: Flags [S], cksum 0x4d75 (correct), seq 1301062802, win 29200, options [mss 1460,sackOK,TS val 13869953 ecr 0,nop,wscale 7], length 0
    10.30.1.65.43279 > 10.30.5.234.1720: Flags [S], cksum 0xd482 (correct), seq 1035092800, win 29200, options [mss 1460,sackOK,TS val 13870078 ecr 0,nop,wscale 7], length 0
    10.30.1.65.56029 > 10.30.5.234.53: Flags [S], cksum 0xe795 (correct), seq 1733679809, win 29200, options [mss 1460,sackOK,TS val 13870203 ecr 0,nop,wscale 7], length 0
    10.30.1.65.51972 > 10.30.5.234.25: Flags [S], cksum 0x08f1 (correct), seq 519115074, win 29200, options [mss 1460,sackOK,TS val 13870329 ecr 0,nop,wscale 7], length 0
    10.30.1.65.35338 > 10.30.5.234.993: Flags [S], cksum 0x24e3 (correct), seq 1142688987, win 29200, options [mss 1460,sackOK,TS val 13870453 ecr 0,nop,wscale 7], length 0
    10.30.1.65.56008 > 10.30.5.234.445: Flags [S], cksum 0xe387 (correct), seq 3360062071, win 29200, options [mss 1460,sackOK,TS val 13870703 ecr 0,nop,wscale 7], length 0
    10.30.1.65.37862 > 10.30.5.234.5900: Flags [S], cksum 0xbc9d (correct), seq 2968578509, win 29200, options [mss 1460,sackOK,TS val 13870828 ecr 0,nop,wscale 7], length 0
    10.30.1.65.36646 > 10.30.5.234.587: Flags [S], cksum 0x661e (correct), seq 1621141921, win 29200, options [mss 1460,sackOK,TS val 13870953 ecr 0,nop,wscale 7], length 0
    10.30.1.65.53328 > 10.30.5.234.1723: Flags [S], cksum 0xb59a (correct), seq 4278547880, win 29200, options [mss 1460,sackOK,TS val 13871078 ecr 0,nop,wscale 7], length 0
    10.30.1.65.44528 > 10.30.5.234.23: Flags [S], cksum 0x6fec (correct), seq 144366153, win 29200, options [mss 1460,sackOK,TS val 13871203 ecr 0,nop,wscale 7], length 0
    10.30.1.65.60477 > 10.30.5.234.443: Flags [S], cksum 0xbe2b (correct), seq 1303381638, win 29200, options [mss 1460,sackOK,TS val 13871328 ecr 0,nop,wscale 7], length 0
    10.30.1.65.51881 > 10.30.5.234.139: Flags [S], cksum 0x748d (correct), seq 1946635284, win 29200, options [mss 1460,sackOK,TS val 13871453 ecr 0,nop,wscale 7], length 0
    10.30.1.65.47569 > 10.30.5.234.135: Flags [S], cksum 0x4551 (correct), seq 1906609682, win 29200, options [mss 1460,sackOK,TS val 13871578 ecr 0,nop,wscale 7], length 0
    10.30.1.65.33694 > 10.30.5.234.1025: Flags [S], cksum 0x6416 (correct), seq 3607510055, win 29200, options [mss 1460,sackOK,TS val 13871703 ecr 0,nop,wscale 7], length 0
    10.30.1.65.52482 > 10.30.5.234.113: Flags [S], cksum 0xead4 (correct), seq 4184624305, win 29200, options [mss 1460,sackOK,TS val 13871828 ecr 0,nop,wscale 7], length 0
    10.30.1.65.33765 > 10.30.5.234.111: Flags [S], cksum 0xb5b3 (correct), seq 234468840, win 29200, options [mss 1460,sackOK,TS val 13871953 ecr 0,nop,wscale 7], length 0
    10.30.1.65.37697 > 10.30.5.234.110: Flags [S], cksum 0x1831 (correct), seq 221594711, win 29200, options [mss 1460,sackOK,TS val 13872078 ecr 0,nop,wscale 7], length 0
    10.30.1.65.34804 > 10.30.5.234.3389: Flags [S], cksum 0x19df (correct), seq 2623254915, win 29200, options [mss 1460,sackOK,TS val 13872203 ecr 0,nop,wscale 7], length 0
    10.30.1.65.49989 > 10.30.5.234.28201: Flags [S], cksum 0xb2d9 (correct), seq 4125303366, win 29200, options [mss 1460,sackOK,TS val 13872328 ecr 0,nop,wscale 7], length 0
    10.30.1.65.58051 > 10.30.5.234.2043: Flags [S], cksum 0x8ac7 (correct), seq 2244280490, win 29200, options [mss 1460,sackOK,TS val 13872453 ecr 0,nop,wscale 7], length 0
    10.30.1.65.53576 > 10.30.5.234.5226: Flags [S], cksum 0xa1a1 (correct), seq 2931541352, win 29200, options [mss 1460,sackOK,TS val 13872578 ecr 0,nop,wscale 7], length 0
    10.30.1.65.54028 > 10.30.5.234.1301: Flags [S], cksum 0x7440 (correct), seq 3140612967, win 29200, options [mss 1460,sackOK,TS val 13872703 ecr 0,nop,wscale 7], length 0
    10.30.1.65.47485 > 10.30.5.234.1721: Flags [S], cksum 0x8726 (correct), seq 2896889462, win 29200, options [mss 1460,sackOK,TS val 13872828 ecr 0,nop,wscale 7], length 0
    10.30.1.65.59054 > 10.30.5.234.2144: Flags [S], cksum 0xc573 (correct), seq 2963444956, win 29200, options [mss 1460,sackOK,TS val 13872953 ecr 0,nop,wscale 7], length 0
    10.30.1.65.37715 > 10.30.5.234.45100: Flags [S], cksum 0x564d (correct), seq 2957356912, win 29200, options [mss 1460,sackOK,TS val 13873079 ecr 0,nop,wscale 7], length 0
    10.30.1.65.56086 > 10.30.5.234.5221: Flags [S], cksum 0xecf9 (correct), seq 807922794, win 29200, options [mss 1460,sackOK,TS val 13873203 ecr 0,nop,wscale 7], length 0
    10.30.1.65.42245 > 10.30.5.234.7001: Flags [S], cksum 0x6085 (correct), seq 927047781, win 29200, options [mss 1460,sackOK,TS val 13873328 ecr 0,nop,wscale 7], length 0
    10.30.1.65.42934 > 10.30.5.234.800: Flags [S], cksum 0xa687 (correct), seq 1277188751, win 29200, options [mss 1460,sackOK,TS val 13873453 ecr 0,nop,wscale 7], length 0
    10.30.1.65.49646 > 10.30.5.234.32782: Flags [S], cksum 0x517f (correct), seq 1880028165, win 29200, options [mss 1460,sackOK,TS val 13873578 ecr 0,nop,wscale 7], length 0
    10.30.1.65.55622 > 10.30.5.234.222: Flags [S], cksum 0xb10d (correct), seq 789658832, win 29200, options [mss 1460,sackOK,TS val 13873703 ecr 0,nop,wscale 7], length 0
    10.30.1.65.60995 > 10.30.5.234.9100: Flags [S], cksum 0x0296 (correct), seq 1730640649, win 29200, options [mss 1460,sackOK,TS val 13873828 ecr 0,nop,wscale 7], length 0
    10.30.1.65.47197 > 10.30.5.234.18040: Flags [S], cksum 0xb9ee (correct), seq 3669975701, win 29200, options [mss 1460,sackOK,TS val 13873953 ecr 0,nop,wscale 7], length 0
    10.30.1.65.59073 > 10.30.5.234.1048: Flags [S], cksum 0x3367 (correct), seq 2004901851, win 29200, options [mss 1460,sackOK,TS val 13874078 ecr 0,nop,wscale 7], length 0
    10.30.1.65.54206 > 10.30.5.234.9418: Flags [S], cksum 0x48a3 (correct), seq 1235118677, win 29200, options [mss 1460,sackOK,TS val 13874203 ecr 0,nop,wscale 7], length 0
    10.30.1.65.39054 > 10.30.5.234.1433: Flags [S], cksum 0xc31b (correct), seq 576352517, win 29200, options [mss 1460,sackOK,TS val 13874328 ecr 0,nop,wscale 7], length 0
    10.30.1.65.45349 > 10.30.5.234.5910: Flags [S], cksum 0x40e0 (correct), seq 480955999, win 29200, options [mss 1460,sackOK,TS val 13874453 ecr 0,nop,wscale 7], length 0
    10.30.1.65.41191 > 10.30.5.234.7435: Flags [S], cksum 0x9f90 (correct), seq 4069303192, win 29200, options [mss 1460,sackOK,TS val 13874578 ecr 0,nop,wscale 7], length 0
    10.30.1.65.47570 > 10.30.5.234.2042: Flags [S], cksum 0x67b8 (correct), seq 616801507, win 29200, options [mss 1460,sackOK,TS val 13874703 ecr 0,nop,wscale 7], length 0
    10.30.1.65.36379 > 10.30.5.234.14238: Flags [S], cksum 0x27c4 (correct), seq 870502734, win 29200, options [mss 1460,sackOK,TS val 13874828 ecr 0,nop,wscale 7], length 0
    10.30.1.65.53643 > 10.30.5.234.9101: Flags [S], cksum 0x6470 (correct), seq 4188446465, win 29200, options [mss 1460,sackOK,TS val 13874953 ecr 0,nop,wscale 7], length 0
    10.30.1.65.44733 > 10.30.5.234.10004: Flags [S], cksum 0x7054 (correct), seq 1736918023, win 29200, options [mss 1460,sackOK,TS val 13875078 ecr 0,nop,wscale 7], length 0
    10.30.1.65.39072 > 10.30.5.234.5963: Flags [S], cksum 0x0df7 (correct), seq 4214568991, win 29200, options [mss 1460,sackOK,TS val 13875203 ecr 0,nop,wscale 7], length 0
    10.30.1.65.44425 > 10.30.5.234.2301: Flags [S], cksum 0xf62d (correct), seq 3932510624, win 29200, options [mss 1460,sackOK,TS val 13875328 ecr 0,nop,wscale 7], length 0
    10.30.1.65.47995 > 10.30.5.234.1169: Flags [S], cksum 0x1f16 (correct), seq 3680974259, win 29200, options [mss 1460,sackOK,TS val 13875453 ecr 0,nop,wscale 7], length 0
    10.30.1.65.48196 > 10.30.5.234.8254: Flags [S], cksum 0x697f (correct), seq 2025664769, win 29200, options [mss 1460,sackOK,TS val 13875578 ecr 0,nop,wscale 7], length 0
    10.30.1.65.42975 > 10.30.5.234.1218: Flags [S], cksum 0x3d10 (correct), seq 2519297896, win 29200, options [mss 1460,sackOK,TS val 13875703 ecr 0,nop,wscale 7], length 0
    10.30.1.65.43231 > 10.30.5.234.1047: Flags [S], cksum 0x3f32 (correct), seq 3030928885, win 29200, options [mss 1460,sackOK,TS val 13875828 ecr 0,nop,wscale 7], length 0
    10.30.1.65.60870 > 10.30.5.234.5904: Flags [S], cksum 0x87cc (correct), seq 3960894863, win 29200, options [mss 1460,sackOK,TS val 13875953 ecr 0,nop,wscale 7], length 0
    10.30.1.65.60953 > 10.30.5.234.5952: Flags [S], cksum 0x7c5f (correct), seq 3594294742, win 29200, options [mss 1460,sackOK,TS val 13876078 ecr 0,nop,wscale 7], length 0
    10.30.1.65.59846 > 10.30.5.234.4899: Flags [S], cksum 0xec99 (correct), seq 1041286587, win 29200, options [mss 1460,sackOK,TS val 13876203 ecr 0,nop,wscale 7], length 0
    10.30.1.65.55510 > 10.30.5.234.8300: Flags [S], cksum 0x939d (correct), seq 150886132, win 29200, options [mss 1460,sackOK,TS val 13876328 ecr 0,nop,wscale 7], length 0
    10.30.1.65.38398 > 10.30.5.234.1719: Flags [S], cksum 0x8fae (correct), seq 214676262, win 29200, options [mss 1460,sackOK,TS val 13876453 ecr 0,nop,wscale 7], length 0
    10.30.1.65.53033 > 10.30.5.234.42510: Flags [S], cksum 0xbccd (correct), seq 3347051090, win 29200, options [mss 1460,sackOK,TS val 13876578 ecr 0,nop,wscale 7], length 0
    10.30.1.65.40735 > 10.30.5.234.3517: Flags [S], cksum 0xbf78 (correct), seq 390227908, win 29200, options [mss 1460,sackOK,TS val 13876703 ecr 0,nop,wscale 7], length 0
    10.30.1.65.34029 > 10.30.5.234.6666: Flags [S], cksum 0x2ac3 (correct), seq 84548634, win 29200, options [mss 1460,sackOK,TS val 13876828 ecr 0,nop,wscale 7], length 0
    10.30.1.65.36148 > 10.30.5.234.32785: Flags [S], cksum 0xa483 (correct), seq 2152511563, win 29200, options [mss 1460,sackOK,TS val 13876953 ecr 0,nop,wscale 7], length 0
    10.30.1.65.45000 > 10.30.5.234.1947: Flags [S], cksum 0xd709 (correct), seq 2264192130, win 29200, options [mss 1460,sackOK,TS val 13877078 ecr 0,nop,wscale 7], length 0
    10.30.1.65.55331 > 10.30.5.234.4001: Flags [S], cksum 0xca88 (correct), seq 3774109221, win 29200, options [mss 1460,sackOK,TS val 13877203 ecr 0,nop,wscale 7], length 0
    10.30.1.65.55186 > 10.30.5.234.3878: Flags [S], cksum 0x7d22 (correct), seq 4049114038, win 29200, options [mss 1460,sackOK,TS val 13877328 ecr 0,nop,wscale 7], length 0
    10.30.1.65.54188 > 10.30.5.234.3889: Flags [S], cksum 0x66c8 (correct), seq 4003311657, win 29200, options [mss 1460,sackOK,TS val 13877453 ecr 0,nop,wscale 7], length 0
    10.30.1.65.39127 > 10.30.5.234.2200: Flags [S], cksum 0xbdee (correct), seq 4229926002, win 29200, options [mss 1460,sackOK,TS val 13877578 ecr 0,nop,wscale 7], length 0
    10.30.1.65.54312 > 10.30.5.234.10628: Flags [S], cksum 0x4e46 (correct), seq 428573173, win 29200, options [mss 1460,sackOK,TS val 13877703 ecr 0,nop,wscale 7], length 0
    10.30.1.65.35851 > 10.30.5.234.14442: Flags [S], cksum 0x9f9c (correct), seq 140081802, win 29200, options [mss 1460,sackOK,TS val 13877829 ecr 0,nop,wscale 7], length 0
    10.30.1.65.49909 > 10.30.5.234.144: Flags [S], cksum 0x714c (correct), seq 2816477639, win 29200, options [mss 1460,sackOK,TS val 13877953 ecr 0,nop,wscale 7], length 0
    10.30.1.65.42331 > 10.30.5.234.1086: Flags [S], cksum 0xaf36 (correct), seq 3181367180, win 29200, options [mss 1460,sackOK,TS val 13878078 ecr 0,nop,wscale 7], length 0
    10.30.1.65.48081 > 10.30.5.234.7443: Flags [S], cksum 0xf0ba (correct), seq 1209193421, win 29200, options [mss 1460,sackOK,TS val 13878203 ecr 0,nop,wscale 7], length 0
    10.30.1.65.39241 > 10.30.5.234.10025: Flags [S], cksum 0x63a7 (correct), seq 1068794164, win 29200, options [mss 1460,sackOK,TS val 13878328 ecr 0,nop,wscale 7], length 0
    10.30.1.65.52696 > 10.30.5.234.9618: Flags [S], cksum 0x6c3d (correct), seq 2522869373, win 29200, options [mss 1460,sackOK,TS val 13878453 ecr 0,nop,wscale 7], length 0
    10.30.1.65.56597 > 10.30.5.234.548: Flags [S], cksum 0x0e03 (correct), seq 420339134, win 29200, options [mss 1460,sackOK,TS val 13878578 ecr 0,nop,wscale 7], length 0
    10.30.1.65.37006 > 10.30.5.234.843: Flags [S], cksum 0x4263 (correct), seq 3551082917, win 29200, options [mss 1460,sackOK,TS val 13878703 ecr 0,nop,wscale 7], length 0
    10.30.1.65.47059 > 10.30.5.234.8100: Flags [S], cksum 0x66be (correct), seq 3805790720, win 29200, options [mss 1460,sackOK,TS val 13878828 ecr 0,nop,wscale 7], length 0
    10.30.1.65.45988 > 10.30.5.234.1151: Flags [S], cksum 0x6a60 (correct), seq 1812878335, win 29200, options [mss 1460,sackOK,TS val 13878953 ecr 0,nop,wscale 7], length 0
    10.30.1.65.39600 > 10.30.5.234.4045: Flags [S], cksum 0x8385 (correct), seq 858882272, win 29200, options [mss 1460,sackOK,TS val 13879078 ecr 0,nop,wscale 7], length 0
    10.30.1.65.54620 > 10.30.5.234.3493: Flags [S], cksum 0x7a9a (correct), seq 2547313702, win 29200, options [mss 1460,sackOK,TS val 13879203 ecr 0,nop,wscale 7], length 0
    10.30.1.65.47472 > 10.30.5.234.1085: Flags [S], cksum 0xadb4 (correct), seq 2543574556, win 29200, options [mss 1460,sackOK,TS val 13879328 ecr 0,nop,wscale 7], length 0
    10.30.1.65.53448 > 10.30.5.234.3322: Flags [S], cksum 0xc50c (correct), seq 50543307, win 29200, options [mss 1460,sackOK,TS val 13879453 ecr 0,nop,wscale 7], length 0
    10.30.1.65.57586 > 10.30.5.234.3221: Flags [S], cksum 0x1b6e (correct), seq 4001228972, win 29200, options [mss 1460,sackOK,TS val 13879578 ecr 0,nop,wscale 7], length 0
    10.30.1.65.34258 > 10.30.5.234.1137: Flags [S], cksum 0xa407 (correct), seq 1233741775, win 29200, options [mss 1460,sackOK,TS val 13879703 ecr 0,nop,wscale 7], length 0
    10.30.1.65.60751 > 10.30.5.234.6699: Flags [S], cksum 0x2dac (correct), seq 2455967644, win 29200, options [mss 1460,sackOK,TS val 13879828 ecr 0,nop,wscale 7], length 0
    10.30.1.65.44422 > 10.30.5.234.13722: Flags [S], cksum 0x8354 (correct), seq 893731567, win 29200, options [mss 1460,sackOK,TS val 13879953 ecr 0,nop,wscale 7], length 0
    10.30.1.65.37819 > 10.30.5.234.10629: Flags [S], cksum 0x91ba (correct), seq 289373682, win 29200, options [mss 1460,sackOK,TS val 13880078 ecr 0,nop,wscale 7], length 0
    10.30.1.65.46263 > 10.30.5.234.1068: Flags [S], cksum 0x78a8 (correct), seq 3536771412, win 29200, options [mss 1460,sackOK,TS val 13880203 ecr 0,nop,wscale 7], length 0
    10.30.1.65.60437 > 10.30.5.234.4662: Flags [S], cksum 0xa7e9 (correct), seq 508434607, win 29200, options [mss 1460,sackOK,TS val 13880328 ecr 0,nop,wscale 7], length 0
    10.30.1.65.60438 > 10.30.5.234.4662: Flags [S], cksum 0xb5a9 (correct), seq 1751564126, win 29200, options [mss 1460,sackOK,TS val 13880703 ecr 0,nop,wscale 7], length 0
    10.30.1.65.35821 > 10.30.5.234.8333: Flags [S], cksum 0xd83c (correct), seq 1687548526, win 29200, options [mss 1460,sackOK,TS val 13880703 ecr 0,nop,wscale 7], length 0
    10.30.1.65.52413 > 10.30.5.234.10778: Flags [S], cksum 0x943a (correct), seq 3459940974, win 29200, options [mss 1460,sackOK,TS val 13880703 ecr 0,nop,wscale 7], length 0
    10.30.1.65.33134 > 10.30.5.234.9010: Flags [S], cksum 0xcac1 (correct), seq 2859581802, win 29200, options [mss 1460,sackOK,TS val 13880828 ecr 0,nop,wscale 7], length 0
    10.30.1.65.49096 > 10.30.5.234.668: Flags [S], cksum 0xd340 (correct), seq 3028193437, win 29200, options [mss 1460,sackOK,TS val 13880953 ecr 0,nop,wscale 7], length 0
    10.30.1.65.42640 > 10.30.5.234.1097: Flags [S], cksum 0xe187 (correct), seq 3264121684, win 29200, options [mss 1460,sackOK,TS val 13881078 ecr 0,nop,wscale 7], length 0
    10.30.1.65.39608 > 10.30.5.234.1287: Flags [S], cksum 0x79c1 (correct), seq 1711037002, win 29200, options [mss 1460,sackOK,TS val 13881203 ecr 0,nop,wscale 7], length 0
    10.30.1.65.46646 > 10.30.5.234.1310: Flags [S], cksum 0x767b (correct), seq 4263881044, win 29200, options [mss 1460,sackOK,TS val 13881328 ecr 0,nop,wscale 7], length 0
    10.30.1.65.35949 > 10.30.5.234.65000: Flags [S], cksum 0x7319 (correct), seq 761441787, win 29200, options [mss 1460,sackOK,TS val 13881453 ecr 0,nop,wscale 7], length 0
    10.30.1.65.57535 > 10.30.5.234.1417: Flags [S], cksum 0xb4ac (correct), seq 3993063257, win 29200, options [mss 1460,sackOK,TS val 13881578 ecr 0,nop,wscale 7], length 0
    10.30.1.65.57786 > 10.30.5.234.4550: Flags [S], cksum 0xea0a (correct), seq 1981711401, win 29200, options [mss 1460,sackOK,TS val 13881703 ecr 0,nop,wscale 7], length 0
    10.30.1.65.51252 > 10.30.5.234.563: Flags [S], cksum 0x1e1f (correct), seq 2272356190, win 29200, options [mss 1460,sackOK,TS val 13881828 ecr 0,nop,wscale 7], length 0
    10.30.1.65.35431 > 10.30.5.234.30: Flags [S], cksum 0x4a9f (correct), seq 796643897, win 29200, options [mss 1460,sackOK,TS val 13881953 ecr 0,nop,wscale 7], length 0
    10.30.1.65.53731 > 10.30.5.234.6000: Flags [S], cksum 0xdd91 (correct), seq 2556589844, win 29200, options [mss 1460,sackOK,TS val 13882078 ecr 0,nop,wscale 7], length 0
    10.30.1.65.41943 > 10.30.5.234.3828: Flags [S], cksum 0x1082 (correct), seq 2118423629, win 29200, options [mss 1460,sackOK,TS val 13882203 ecr 0,nop,wscale 7], length 0
    10.30.1.65.37427 > 10.30.5.234.49167: Flags [S], cksum 0x75a7 (correct), seq 312670933, win 29200, options [mss 1460,sackOK,TS val 13882328 ecr 0,nop,wscale 7], length 0
    10.30.1.65.33651 > 10.30.5.234.1009: Flags [S], cksum 0x718d (correct), seq 2704751292, win 29200, options [mss 1460,sackOK,TS val 13882453 ecr 0,nop,wscale 7], length 0
    10.30.1.65.33788 > 10.30.5.234.808: Flags [S], cksum 0xed1b (correct), seq 929704126, win 29200, options [mss 1460,sackOK,TS val 13882578 ecr 0,nop,wscale 7], length 0
    10.30.1.65.59802 > 10.30.5.234.1233: Flags [S], cksum 0xe6ef (correct), seq 4240835017, win 29200, options [mss 1460,sackOK,TS val 13882703 ecr 0,nop,wscale 7], length 0
    10.30.1.65.56058 > 10.30.5.234.6881: Flags [S], cksum 0x80b1 (correct), seq 3597174392, win 29200, options [mss 1460,sackOK,TS val 13882828 ecr 0,nop,wscale 7], length 0
    10.30.1.65.33890 > 10.30.5.234.2967: Flags [S], cksum 0xaf93 (correct), seq 2331904102, win 29200, options [mss 1460,sackOK,TS val 13882953 ecr 0,nop,wscale 7], length 0
    10.30.1.65.51561 > 10.30.5.234.5002: Flags [S], cksum 0x1733 (correct), seq 1948215853, win 29200, options [mss 1460,sackOK,TS val 13883079 ecr 0,nop,wscale 7], length 0
    10.30.1.65.41487 > 10.30.5.234.38292: Flags [S], cksum 0xdfd9 (correct), seq 394240762, win 29200, options [mss 1460,sackOK,TS val 13883203 ecr 0,nop,wscale 7], length 0
    10.30.1.65.58730 > 10.30.5.234.5988: Flags [S], cksum 0x4fe5 (correct), seq 2726486594, win 29200, options [mss 1460,sackOK,TS val 13883329 ecr 0,nop,wscale 7], length 0
    10.30.1.65.58203 > 10.30.5.234.3324: Flags [S], cksum 0x97e3 (correct), seq 943853696, win 29200, options [mss 1460,sackOK,TS val 13883453 ecr 0,nop,wscale 7], length 0
    10.30.1.65.42735 > 10.30.5.234.11111: Flags [S], cksum 0xa207 (correct), seq 2263143741, win 29200, options [mss 1460,sackOK,TS val 13883578 ecr 0,nop,wscale 7], length 0
    10.30.1.65.38350 > 10.30.5.234.1154: Flags [S], cksum 0x8060 (correct), seq 2992112378, win 29200, options [mss 1460,sackOK,TS val 13883703 ecr 0,nop,wscale 7], length 0
    10.30.1.65.50417 > 10.30.5.234.19283: Flags [S], cksum 0x0664 (correct), seq 2124364350, win 29200, options [mss 1460,sackOK,TS val 13883828 ecr 0,nop,wscale 7], length 0
    10.30.1.65.51443 > 10.30.5.234.1352: Flags [S], cksum 0x4d76 (correct), seq 3506954831, win 29200, options [mss 1460,sackOK,TS val 13883953 ecr 0,nop,wscale 7], length 0
    10.30.1.65.38120 > 10.30.5.234.51103: Flags [S], cksum 0x6226 (correct), seq 1761257187, win 29200, options [mss 1460,sackOK,TS val 13884078 ecr 0,nop,wscale 7], length 0
    10.30.1.65.41500 > 10.30.5.234.2500: Flags [S], cksum 0xe2d7 (correct), seq 3598411995, win 29200, options [mss 1460,sackOK,TS val 13884203 ecr 0,nop,wscale 7], length 0
    10.30.1.65.56868 > 10.30.5.234.8085: Flags [S], cksum 0x15b5 (correct), seq 514235260, win 29200, options [mss 1460,sackOK,TS val 13884329 ecr 0,nop,wscale 7], length 0
    10.30.1.65.33950 > 10.30.5.234.20000: Flags [S], cksum 0x73ca (correct), seq 2303851834, win 29200, options [mss 1460,sackOK,TS val 13884453 ecr 0,nop,wscale 7], length 0
    10.30.1.65.51583 > 10.30.5.234.2033: Flags [S], cksum 0xf7c0 (correct), seq 3427743511, win 29200, options [mss 1460,sackOK,TS val 13884578 ecr 0,nop,wscale 7], length 0
    10.30.1.65.55292 > 10.30.5.234.10082: Flags [S], cksum 0xcf67 (correct), seq 2478664087, win 29200, options [mss 1460,sackOK,TS val 13884703 ecr 0,nop,wscale 7], length 0
    10.30.1.65.37753 > 10.30.5.234.1863: Flags [S], cksum 0x9d65 (correct), seq 3679303722, win 29200, options [mss 1460,sackOK,TS val 13884828 ecr 0,nop,wscale 7], length 0
    10.30.1.65.60183 > 10.30.5.234.8087: Flags [S], cksum 0x0ae3 (correct), seq 707496804, win 29200, options [mss 1460,sackOK,TS val 13884953 ecr 0,nop,wscale 7], length 0
    10.30.1.65.49090 > 10.30.5.234.1: Flags [S], cksum 0x044a (correct), seq 3021951607, win 29200, options [mss 1460,sackOK,TS val 13885078 ecr 0,nop,wscale 7], length 0
    10.30.1.65.38722 > 10.30.5.234.4900: Flags [S], cksum 0xc3bb (correct), seq 3904992067, win 29200, options [mss 1460,sackOK,TS val 13885203 ecr 0,nop,wscale 7], length 0
    10.30.1.65.42503 > 10.30.5.234.5730: Flags [S], cksum 0x2c4d (correct), seq 4274971172, win 29200, options [mss 1460,sackOK,TS val 13885328 ecr 0,nop,wscale 7], length 0
    10.30.1.65.48217 > 10.30.5.234.7920: Flags [S], cksum 0xba09 (correct), seq 3391973804, win 29200, options [mss 1460,sackOK,TS val 13885453 ecr 0,nop,wscale 7], length 0
    10.30.1.65.43437 > 10.30.5.234.1862: Flags [S], cksum 0x6533 (correct), seq 3276533565, win 29200, options [mss 1460,sackOK,TS val 13885578 ecr 0,nop,wscale 7], length 0
    10.30.1.65.56951 > 10.30.5.234.32775: Flags [S], cksum 0x0f52 (correct), seq 3272120153, win 29200, options [mss 1460,sackOK,TS val 13885703 ecr 0,nop,wscale 7], length 0
    10.30.1.65.44960 > 10.30.5.234.56738: Flags [S], cksum 0x5830 (correct), seq 125885122, win 29200, options [mss 1460,sackOK,TS val 13885828 ecr 0,nop,wscale 7], length 0
    10.30.1.65.49931 > 10.30.5.234.1521: Flags [S], cksum 0x52f7 (correct), seq 3489454920, win 29200, options [mss 1460,sackOK,TS val 13885953 ecr 0,nop,wscale 7], length 0
    10.30.1.65.54928 > 10.30.5.234.7741: Flags [S], cksum 0x3226 (correct), seq 1850552699, win 29200, options [mss 1460,sackOK,TS val 13886078 ecr 0,nop,wscale 7], length 0
    10.30.1.65.48912 > 10.30.5.234.714: Flags [S], cksum 0xdd60 (correct), seq 3761325778, win 29200, options [mss 1460,sackOK,TS val 13886203 ecr 0,nop,wscale 7], length 0
    10.30.1.65.55483 > 10.30.5.234.161: Flags [S], cksum 0xefaa (correct), seq 4242800598, win 29200, options [mss 1460,sackOK,TS val 13886328 ecr 0,nop,wscale 7], length 0
    10.30.1.65.60034 > 10.30.5.234.11967: Flags [S], cksum 0xeaaa (correct), seq 1711364951, win 29200, options [mss 1460,sackOK,TS val 13886453 ecr 0,nop,wscale 7], length 0
    10.30.1.65.36177 > 10.30.5.234.3689: Flags [S], cksum 0x5982 (correct), seq 3298757356, win 29200, options [mss 1460,sackOK,TS val 13886578 ecr 0,nop,wscale 7], length 0
    10.30.1.65.49719 > 10.30.5.234.3766: Flags [S], cksum 0x3ab9 (correct), seq 2183083653, win 29200, options [mss 1460,sackOK,TS val 13886703 ecr 0,nop,wscale 7], length 0
    10.30.1.65.43316 > 10.30.5.234.720: Flags [S], cksum 0xa9df (correct), seq 1054945032, win 29200, options [mss 1460,sackOK,TS val 13886829 ecr 0,nop,wscale 7], length 0
    10.30.1.65.45504 > 10.30.5.234.5987: Flags [S], cksum 0x95af (correct), seq 3496973326, win 29200, options [mss 1460,sackOK,TS val 13886953 ecr 0,nop,wscale 7], length 0
    10.30.1.65.56806 > 10.30.5.234.8649: Flags [S], cksum 0xe142 (correct), seq 275435894, win 29200, options [mss 1460,sackOK,TS val 13887079 ecr 0,nop,wscale 7], length 0
    10.30.1.65.54697 > 10.30.5.234.9001: Flags [S], cksum 0x5e0c (correct), seq 4236013307, win 29200, options [mss 1460,sackOK,TS val 13887203 ecr 0,nop,wscale 7], length 0
    10.30.1.65.52685 > 10.30.5.234.10617: Flags [S], cksum 0xf987 (correct), seq 1630498780, win 29200, options [mss 1460,sackOK,TS val 13887328 ecr 0,nop,wscale 7], length 0
    10.30.1.65.56202 > 10.30.5.234.1213: Flags [S], cksum 0x1298 (correct), seq 478851571, win 29200, options [mss 1460,sackOK,TS val 13887453 ecr 0,nop,wscale 7], length 0
    10.30.1.65.39005 > 10.30.5.234.1594: Flags [S], cksum 0x9417 (correct), seq 167806001, win 29200, options [mss 1460,sackOK,TS val 13887578 ecr 0,nop,wscale 7], length 0
    10.30.1.65.57042 > 10.30.5.234.18988: Flags [S], cksum 0x321c (correct), seq 3334053518, win 29200, options [mss 1460,sackOK,TS val 13887703 ecr 0,nop,wscale 7], length 0
    10.30.1.65.52826 > 10.30.5.234.7000: Flags [S], cksum 0x8788 (correct), seq 1532556114, win 29200, options [mss 1460,sackOK,TS val 13887828 ecr 0,nop,wscale 7], length 0
    10.30.1.65.37996 > 10.30.5.234.64623: Flags [S], cksum 0xe298 (correct), seq 3852428884, win 29200, options [mss 1460,sackOK,TS val 13887953 ecr 0,nop,wscale 7], length 0
    10.30.1.65.45860 > 10.30.5.234.1309: Flags [S], cksum 0x73d4 (correct), seq 3889081095, win 29200, options [mss 1460,sackOK,TS val 13888078 ecr 0,nop,wscale 7], length 0
    10.30.1.65.41774 > 10.30.5.234.22939: Flags [S], cksum 0x1705 (correct), seq 1712735370, win 29200, options [mss 1460,sackOK,TS val 13888203 ecr 0,nop,wscale 7], length 0
    10.30.1.65.54703 > 10.30.5.234.1108: Flags [S], cksum 0x259f (correct), seq 1494181184, win 29200, options [mss 1460,sackOK,TS val 13888328 ecr 0,nop,wscale 7], length 0
    10.30.1.65.47998 > 10.30.5.234.2382: Flags [S], cksum 0xd3de (correct), seq 3377945458, win 29200, options [mss 1460,sackOK,TS val 13888453 ecr 0,nop,wscale 7], length 0
    10.30.1.65.32950 > 10.30.5.234.15000: Flags [S], cksum 0x96c3 (correct), seq 2912337231, win 29200, options [mss 1460,sackOK,TS val 13888578 ecr 0,nop,wscale 7], length 0
    10.30.1.65.55291 > 10.30.5.234.1443: Flags [S], cksum 0x2a8d (correct), seq 3603684739, win 29200, options [mss 1460,sackOK,TS val 13888703 ecr 0,nop,wscale 7], length 0
    10.30.1.65.35009 > 10.30.5.234.1010: Flags [S], cksum 0x47db (correct), seq 4234734342, win 29200, options [mss 1460,sackOK,TS val 13888828 ecr 0,nop,wscale 7], length 0
    10.30.1.65.36292 > 10.30.5.234.35500: Flags [S], cksum 0x9959 (correct), seq 4063369092, win 29200, options [mss 1460,sackOK,TS val 13888953 ecr 0,nop,wscale 7], length 0
    10.30.1.65.57131 > 10.30.5.234.49155: Flags [S], cksum 0x5934 (correct), seq 3465212948, win 29200, options [mss 1460,sackOK,TS val 13889079 ecr 0,nop,wscale 7], length 0
    10.30.1.65.45670 > 10.30.5.234.6156: Flags [S], cksum 0x72a6 (correct), seq 872958310, win 29200, options [mss 1460,sackOK,TS val 13889203 ecr 0,nop,wscale 7], length 0
    10.30.1.65.48020 > 10.30.5.234.1060: Flags [S], cksum 0x91bb (correct), seq 1589250524, win 29200, options [mss 1460,sackOK,TS val 13889328 ecr 0,nop,wscale 7], length 0
    10.30.1.65.54215 > 10.30.5.234.81: Flags [S], cksum 0x0540 (correct), seq 2597602656, win 29200, options [mss 1460,sackOK,TS val 13889453 ecr 0,nop,wscale 7], length 0
    10.30.1.65.47153 > 10.30.5.234.1131: Flags [S], cksum 0x8a7b (correct), seq 3637352745, win 29200, options [mss 1460,sackOK,TS val 13889579 ecr 0,nop,wscale 7], length 0
    10.30.1.65.37935 > 10.30.5.234.1761: Flags [S], cksum 0xf60f (correct), seq 1105520014, win 29200, options [mss 1460,sackOK,TS val 13889703 ecr 0,nop,wscale 7], length 0
    10.30.1.65.35571 > 10.30.5.234.9111: Flags [S], cksum 0x833a (correct), seq 208435685, win 29200, options [mss 1460,sackOK,TS val 13889828 ecr 0,nop,wscale 7], length 0
    10.30.1.65.58277 > 10.30.5.234.1079: Flags [S], cksum 0x69cb (correct), seq 3830808987, win 29200, options [mss 1460,sackOK,TS val 13889953 ecr 0,nop,wscale 7], length 0
    10.30.1.65.35229 > 10.30.5.234.6101: Flags [S], cksum 0x7d11 (correct), seq 2720724589, win 29200, options [mss 1460,sackOK,TS val 13890078 ecr 0,nop,wscale 7], length 0
    10.30.1.65.41509 > 10.30.5.234.2009: Flags [S], cksum 0x53a5 (correct), seq 3923234595, win 29200, options [mss 1460,sackOK,TS val 13890203 ecr 0,nop,wscale 7], length 0
    10.30.1.65.35214 > 10.30.5.234.32778: Flags [S], cksum 0x67a9 (correct), seq 3119483632, win 29200, options [mss 1460,sackOK,TS val 13890328 ecr 0,nop,wscale 7], length 0
    10.30.1.65.40102 > 10.30.5.234.5800: Flags [S], cksum 0xdf49 (correct), seq 3152766753, win 29200, options [mss 1460,sackOK,TS val 13890453 ecr 0,nop,wscale 7], length 0
    10.30.1.65.60653 > 10.30.5.234.1687: Flags [S], cksum 0x5fcb (correct), seq 2919281623, win 29200, options [mss 1460,sackOK,TS val 13890578 ecr 0,nop,wscale 7], length 0
    10.30.1.65.57612 > 10.30.5.234.6346: Flags [S], cksum 0x3834 (correct), seq 784880600, win 29200, options [mss 1460,sackOK,TS val 13890703 ecr 0,nop,wscale 7], length 0
    10.30.1.65.37978 > 10.30.5.234.1051: Flags [S], cksum 0x33ad (correct), seq 3328057772, win 29200, options [mss 1460,sackOK,TS val 13890829 ecr 0,nop,wscale 7], length 0
    10.30.1.65.40826 > 10.30.5.234.49154: Flags [S], cksum 0x306a (correct), seq 1899410067, win 29200, options [mss 1460,sackOK,TS val 13890953 ecr 0,nop,wscale 7], length 0
    10.30.1.65.35662 > 10.30.5.234.515: Flags [S], cksum 0xd417 (correct), seq 476001644, win 29200, options [mss 1460,sackOK,TS val 13891078 ecr 0,nop,wscale 7], length 0
    10.30.1.65.53507 > 10.30.5.234.1021: Flags [S], cksum 0x6f22 (correct), seq 2784610458, win 29200, options [mss 1460,sackOK,TS val 13891203 ecr 0,nop,wscale 7], length 0
    10.30.1.65.59587 > 10.30.5.234.5003: Flags [S], cksum 0xdab6 (correct), seq 3625779991, win 29200, options [mss 1460,sackOK,TS val 13891328 ecr 0,nop,wscale 7], length 0
    10.30.1.65.56998 > 10.30.5.234.1165: Flags [S], cksum 0x6f9b (correct), seq 275467907, win 29200, options [mss 1460,sackOK,TS val 13891453 ecr 0,nop,wscale 7], length 0
    10.30.1.65.39228 > 10.30.5.234.1556: Flags [S], cksum 0xe818 (correct), seq 4069144396, win 29200, options [mss 1460,sackOK,TS val 13891578 ecr 0,nop,wscale 7], length 0
    10.30.1.65.59458 > 10.30.5.234.1718: Flags [S], cksum 0xb2fd (correct), seq 541912704, win 29200, options [mss 1460,sackOK,TS val 13891703 ecr 0,nop,wscale 7], length 0
    10.30.1.65.41880 > 10.30.5.234.9009: Flags [S], cksum 0x5385 (correct), seq 2218791351, win 29200, options [mss 1460,sackOK,TS val 13891828 ecr 0,nop,wscale 7], length 0
    10.30.1.65.53452 > 10.30.5.234.6668: Flags [S], cksum 0x098c (correct), seq 805604192, win 29200, options [mss 1460,sackOK,TS val 13891953 ecr 0,nop,wscale 7], length 0
    10.30.1.65.39359 > 10.30.5.234.5859: Flags [S], cksum 0xecd1 (correct), seq 3661772692, win 29200, options [mss 1460,sackOK,TS val 13892079 ecr 0,nop,wscale 7], length 0
    10.30.1.65.32779 > 10.30.5.234.2383: Flags [S], cksum 0x090e (correct), seq 333777026, win 29200, options [mss 1460,sackOK,TS val 13892203 ecr 0,nop,wscale 7], length 0
    10.30.1.65.59012 > 10.30.5.234.1216: Flags [S], cksum 0x97c0 (correct), seq 3368903295, win 29200, options [mss 1460,sackOK,TS val 13892328 ecr 0,nop,wscale 7], length 0
    10.30.1.65.40684 > 10.30.5.234.1244: Flags [S], cksum 0xd8af (correct), seq 4054532017, win 29200, options [mss 1460,sackOK,TS val 13892453 ecr 0,nop,wscale 7], length 0
    10.30.1.65.59931 > 10.30.5.234.8083: Flags [S], cksum 0x6a3d (correct), seq 49886835, win 29200, options [mss 1460,sackOK,TS val 13892578 ecr 0,nop,wscale 7], length 0
    10.30.1.65.58989 > 10.30.5.234.3809: Flags [S], cksum 0x7705 (correct), seq 3821100229, win 29200, options [mss 1460,sackOK,TS val 13892703 ecr 0,nop,wscale 7], length 0
    10.30.1.65.42634 > 10.30.5.234.61532: Flags [S], cksum 0x5b9a (correct), seq 4238327100, win 29200, options [mss 1460,sackOK,TS val 13892828 ecr 0,nop,wscale 7], length 0
    10.30.1.65.42687 > 10.30.5.234.10000: Flags [S], cksum 0x99e2 (correct), seq 1632559840, win 29200, options [mss 1460,sackOK,TS val 13892953 ecr 0,nop,wscale 7], length 0
    10.30.1.65.33511 > 10.30.5.234.4998: Flags [S], cksum 0xcff1 (correct), seq 4026684674, win 29200, options [mss 1460,sackOK,TS val 13893078 ecr 0,nop,wscale 7], length 0
    10.30.1.65.54600 > 10.30.5.234.3006: Flags [S], cksum 0x1adc (correct), seq 2212047659, win 29200, options [mss 1460,sackOK,TS val 13893203 ecr 0,nop,wscale 7], length 0
    10.30.1.65.36606 > 10.30.5.234.1080: Flags [S], cksum 0xa2c4 (correct), seq 1413881897, win 29200, options [mss 1460,sackOK,TS val 13893328 ecr 0,nop,wscale 7], length 0
    10.30.1.65.37001 > 10.30.5.234.33: Flags [S], cksum 0xad26 (correct), seq 4069620106, win 29200, options [mss 1460,sackOK,TS val 13893453 ecr 0,nop,wscale 7], length 0
    10.30.1.65.52947 > 10.30.5.234.44501: Flags [S], cksum 0x3aae (correct), seq 2750500391, win 29200, options [mss 1460,sackOK,TS val 13893578 ecr 0,nop,wscale 7], length 0
    10.30.1.65.40883 > 10.30.5.234.617: Flags [S], cksum 0x11ca (correct), seq 1059763682, win 29200, options [mss 1460,sackOK,TS val 13893703 ecr 0,nop,wscale 7], length 0
    10.30.1.65.47998 > 10.30.5.234.40911: Flags [S], cksum 0x111d (correct), seq 2818216975, win 29200, options [mss 1460,sackOK,TS val 13893829 ecr 0,nop,wscale 7], length 0
    10.30.1.65.46562 > 10.30.5.234.33899: Flags [S], cksum 0xd1f7 (correct), seq 2000036989, win 29200, options [mss 1460,sackOK,TS val 13893953 ecr 0,nop,wscale 7], length 0
    10.30.1.65.50942 > 10.30.5.234.1236: Flags [S], cksum 0xbf15 (correct), seq 1258541456, win 29200, options [mss 1460,sackOK,TS val 13894078 ecr 0,nop,wscale 7], length 0
    10.30.1.65.59968 > 10.30.5.234.3333: Flags [S], cksum 0x6386 (correct), seq 625354477, win 29200, options [mss 1460,sackOK,TS val 13894203 ecr 0,nop,wscale 7], length 0
    10.30.1.65.48613 > 10.30.5.234.9968: Flags [S], cksum 0xe254 (correct), seq 2751085405, win 29200, options [mss 1460,sackOK,TS val 13894328 ecr 0,nop,wscale 7], length 0
    10.30.1.65.47728 > 10.30.5.234.9944: Flags [S], cksum 0x6186 (correct), seq 1971252663, win 29200, options [mss 1460,sackOK,TS val 13894453 ecr 0,nop,wscale 7], length 0
    10.30.1.65.58462 > 10.30.5.234.3005: Flags [S], cksum 0x2ad4 (correct), seq 1107052700, win 29200, options [mss 1460,sackOK,TS val 13894578 ecr 0,nop,wscale 7], length 0
    10.30.1.65.60038 > 10.30.5.234.5061: Flags [S], cksum 0x4f3a (correct), seq 334578580, win 29200, options [mss 1460,sackOK,TS val 13894703 ecr 0,nop,wscale 7], length 0
    10.30.1.65.56084 > 10.30.5.234.2251: Flags [S], cksum 0xa636 (correct), seq 1483063826, win 29200, options [mss 1460,sackOK,TS val 13894828 ecr 0,nop,wscale 7], length 0
    10.30.1.65.56618 > 10.30.5.234.1641: Flags [S], cksum 0xe43c (correct), seq 2783983184, win 29200, options [mss 1460,sackOK,TS val 13894953 ecr 0,nop,wscale 7], length 0
    10.30.1.65.48418 > 10.30.5.234.1500: Flags [S], cksum 0xf3c9 (correct), seq 3677753749, win 29200, options [mss 1460,sackOK,TS val 13895078 ecr 0,nop,wscale 7], length 0
    10.30.1.65.53511 > 10.30.5.234.1029: Flags [S], cksum 0x1189 (correct), seq 742953017, win 29200, options [mss 1460,sackOK,TS val 13895203 ecr 0,nop,wscale 7], length 0
    10.30.1.65.37921 > 10.30.5.234.3077: Flags [S], cksum 0xea96 (correct), seq 1639822879, win 29200, options [mss 1460,sackOK,TS val 13895328 ecr 0,nop,wscale 7], length 0
    10.30.1.65.47130 > 10.30.5.234.4126: Flags [S], cksum 0x078f (correct), seq 1241614420, win 29200, options [mss 1460,sackOK,TS val 13895453 ecr 0,nop,wscale 7], length 0
    10.30.1.65.48521 > 10.30.5.234.5054: Flags [S], cksum 0x104b (correct), seq 4094610430, win 29200, options [mss 1460,sackOK,TS val 13895578 ecr 0,nop,wscale 7], length 0
    10.30.1.65.33039 > 10.30.5.234.85: Flags [S], cksum 0xab24 (correct), seq 4130307690, win 29200, options [mss 1460,sackOK,TS val 13895703 ecr 0,nop,wscale 7], length 0
    10.30.1.65.52459 > 10.30.5.234.3372: Flags [S], cksum 0xfeef (correct), seq 2961905427, win 29200, options [mss 1460,sackOK,TS val 13895828 ecr 0,nop,wscale 7], length 0
    10.30.1.65.55477 > 10.30.5.234.49161: Flags [S], cksum 0xe5f8 (correct), seq 3464516336, win 29200, options [mss 1460,sackOK,TS val 13895953 ecr 0,nop,wscale 7], length 0
    10.30.1.65.49963 > 10.30.5.234.20222: Flags [S], cksum 0xaa38 (correct), seq 3372816960, win 29200, options [mss 1460,sackOK,TS val 13896078 ecr 0,nop,wscale 7], length 0
    10.30.1.65.43614 > 10.30.5.234.749: Flags [S], cksum 0x277d (correct), seq 4000701424, win 29200, options [mss 1460,sackOK,TS val 13896203 ecr 0,nop,wscale 7], length 0
    10.30.1.65.38719 > 10.30.5.234.7019: Flags [S], cksum 0x3c86 (correct), seq 3721253299, win 29200, options [mss 1460,sackOK,TS val 13896328 ecr 0,nop,wscale 7], length 0
    10.30.1.65.33067 > 10.30.5.234.691: Flags [S], cksum 0x4470 (correct), seq 2407679588, win 29200, options [mss 1460,sackOK,TS val 13896453 ecr 0,nop,wscale 7], length 0
    10.30.1.65.55564 > 10.30.5.234.6502: Flags [S], cksum 0x69d5 (correct), seq 64241052, win 29200, options [mss 1460,sackOK,TS val 13896578 ecr 0,nop,wscale 7], length 0
    10.30.1.65.58228 > 10.30.5.234.280: Flags [S], cksum 0x4820 (correct), seq 3875703179, win 29200, options [mss 1460,sackOK,TS val 13896703 ecr 0,nop,wscale 7], length 0
    10.30.1.65.53493 > 10.30.5.234.1147: Flags [S], cksum 0x14fd (correct), seq 3646281978, win 29200, options [mss 1460,sackOK,TS val 13896828 ecr 0,nop,wscale 7], length 0
    10.30.1.65.53411 > 10.30.5.234.777: Flags [S], cksum 0x7834 (correct), seq 2051200541, win 29200, options [mss 1460,sackOK,TS val 13896953 ecr 0,nop,wscale 7], length 0
    10.30.1.65.36859 > 10.30.5.234.9102: Flags [S], cksum 0x487c (correct), seq 2237209189, win 29200, options [mss 1460,sackOK,TS val 13897078 ecr 0,nop,wscale 7], length 0
    10.30.1.65.34866 > 10.30.5.234.1434: Flags [S], cksum 0x5de3 (correct), seq 3016096721, win 29200, options [mss 1460,sackOK,TS val 13897203 ecr 0,nop,wscale 7], length 0
    10.30.1.65.36255 > 10.30.5.234.2875: Flags [S], cksum 0x2d79 (correct), seq 2354530335, win 29200, options [mss 1460,sackOK,TS val 13897328 ecr 0,nop,wscale 7], length 0
    10.30.1.65.60251 > 10.30.5.234.6009: Flags [S], cksum 0x361d (correct), seq 237458228, win 29200, options [mss 1460,sackOK,TS val 13897453 ecr 0,nop,wscale 7], length 0
    10.30.1.65.42648 > 10.30.5.234.5718: Flags [S], cksum 0x6acc (correct), seq 1129656000, win 29200, options [mss 1460,sackOK,TS val 13897578 ecr 0,nop,wscale 7], length 0
